# timestamp=2026-10-05T10:21:49,276681100+00:00
# command=lspci -vv
00:00.0 Host bridge: Intel Corporation 82G33/G31/P35/P31 Express DRAM Controller
	Subsystem: Red Hat, Inc. QEMU Virtual Machine
	Control: I/O+ Mem+ BusMaster- SpecCycle- MemWINV- VGASnoop- ParErr- Stepping- SERR+ FastB2B- DisINTx-
	Status: Cap- 66MHz- UDF- FastB2B- ParErr- DEVSEL=fast >TAbort- <TAbort- <MAbort- >SERR- <PERR- INTx-

00:01.0 PCI bridge: Red Hat, Inc. QEMU PCIe Root port (prog-if 00 [Normal decode])
	Subsystem: Red Hat, Inc. QEMU PCIe Root port
	Control: I/O+ Mem+ BusMaster+ SpecCycle- MemWINV- VGASnoop- ParErr- Stepping- SERR+ FastB2B- DisINTx+
	Status: Cap+ 66MHz- UDF- FastB2B- ParErr- DEVSEL=fast >TAbort- <TAbort- <MAbort- >SERR- <PERR- INTx-
	Latency: 0
	Interrupt: pin A routed to IRQ 21
	Region 0: Memory at fea00000 (32-bit, non-prefetchable) [size=4K]
	Bus: primary=00, secondary=01, subordinate=01, sec-latency=0
	I/O behind bridge: 1000-1fff [size=4K] [16-bit]
	Memory behind bridge: fe800000-fe9fffff [size=2M] [32-bit]
	Prefetchable memory behind bridge: e9a00000000-e9bffffffff [size=8G] [32-bit]
	Secondary status: 66MHz- FastB2B- ParErr- DEVSEL=fast >TAbort- <TAbort- <MAbort- <SERR- <PERR-
	BridgeCtl: Parity- SERR+ NoISA- VGA- VGA16- MAbort- >Reset- FastB2B-
		PriDiscTmr- SecDiscTmr- DiscTmrStat- DiscTmrSERREn-
	Capabilities: <access denied>
	Kernel driver in use: pcieport

00:01.1 PCI bridge: Red Hat, Inc. QEMU PCIe Root port (prog-if 00 [Normal decode])
	Subsystem: Red Hat, Inc. QEMU PCIe Root port
	Control: I/O+ Mem+ BusMaster+ SpecCycle- MemWINV- VGASnoop- ParErr- Stepping- SERR+ FastB2B- DisINTx+
	Status: Cap+ 66MHz- UDF- FastB2B- ParErr- DEVSEL=fast >TAbort- <TAbort- <MAbort- >SERR- <PERR- INTx-
	Latency: 0
	Interrupt: pin A routed to IRQ 21
	Region 0: Memory at fea01000 (32-bit, non-prefetchable) [size=4K]
	Bus: primary=00, secondary=02, subordinate=02, sec-latency=0
	I/O behind bridge: 2000-2fff [size=4K] [16-bit]
	Memory behind bridge: fe600000-fe7fffff [size=2M] [32-bit]
	Prefetchable memory behind bridge: e9800000000-e99ffffffff [size=8G] [32-bit]
	Secondary status: 66MHz- FastB2B- ParErr- DEVSEL=fast >TAbort- <TAbort- <MAbort- <SERR- <PERR-
	BridgeCtl: Parity- SERR+ NoISA- VGA- VGA16- MAbort- >Reset- FastB2B-
		PriDiscTmr- SecDiscTmr- DiscTmrStat- DiscTmrSERREn-
	Capabilities: <access denied>
	Kernel driver in use: pcieport

00:01.2 PCI bridge: Red Hat, Inc. QEMU PCIe Root port (prog-if 00 [Normal decode])
	Subsystem: Red Hat, Inc. QEMU PCIe Root port
	Control: I/O+ Mem+ BusMaster+ SpecCycle- MemWINV- VGASnoop- ParErr- Stepping- SERR+ FastB2B- DisINTx+
	Status: Cap+ 66MHz- UDF- FastB2B- ParErr- DEVSEL=fast >TAbort- <TAbort- <MAbort- >SERR- <PERR- INTx-
	Latency: 0
	Interrupt: pin A routed to IRQ 21
	Region 0: Memory at fea02000 (32-bit, non-prefetchable) [size=4K]
	Bus: primary=00, secondary=03, subordinate=03, sec-latency=0
	I/O behind bridge: 3000-3fff [size=4K] [16-bit]
	Memory behind bridge: fe400000-fe5fffff [size=2M] [32-bit]
	Prefetchable memory behind bridge: e9600000000-e97ffffffff [size=8G] [32-bit]
	Secondary status: 66MHz- FastB2B- ParErr- DEVSEL=fast >TAbort- <TAbort- <MAbort- <SERR- <PERR-
	BridgeCtl: Parity- SERR+ NoISA- VGA- VGA16- MAbort- >Reset- FastB2B-
		PriDiscTmr- SecDiscTmr- DiscTmrStat- DiscTmrSERREn-
	Capabilities: <access denied>
	Kernel driver in use: pcieport

00:01.3 PCI bridge: Red Hat, Inc. QEMU PCIe Root port (prog-if 00 [Normal decode])
	Subsystem: Red Hat, Inc. QEMU PCIe Root port
	Control: I/O+ Mem+ BusMaster+ SpecCycle- MemWINV- VGASnoop- ParErr- Stepping- SERR+ FastB2B- DisINTx+
	Status: Cap+ 66MHz- UDF- FastB2B- ParErr- DEVSEL=fast >TAbort- <TAbort- <MAbort- >SERR- <PERR- INTx-
	Latency: 0
	Interrupt: pin A routed to IRQ 21
	Region 0: Memory at fea03000 (32-bit, non-prefetchable) [size=4K]
	Bus: primary=00, secondary=04, subordinate=04, sec-latency=0
	I/O behind bridge: 4000-4fff [size=4K] [16-bit]
	Memory behind bridge: fe200000-fe3fffff [size=2M] [32-bit]
	Prefetchable memory behind bridge: e9400000000-e95ffffffff [size=8G] [32-bit]
	Secondary status: 66MHz- FastB2B- ParErr- DEVSEL=fast >TAbort- <TAbort- <MAbort- <SERR- <PERR-
	BridgeCtl: Parity- SERR+ NoISA- VGA- VGA16- MAbort- >Reset- FastB2B-
		PriDiscTmr- SecDiscTmr- DiscTmrStat- DiscTmrSERREn-
	Capabilities: <access denied>
	Kernel driver in use: pcieport

00:01.4 PCI bridge: Red Hat, Inc. QEMU PCIe Root port (prog-if 00 [Normal decode])
	Subsystem: Red Hat, Inc. QEMU PCIe Root port
	Control: I/O+ Mem+ BusMaster+ SpecCycle- MemWINV- VGASnoop- ParErr- Stepping- SERR+ FastB2B- DisINTx+
	Status: Cap+ 66MHz- UDF- FastB2B- ParErr- DEVSEL=fast >TAbort- <TAbort- <MAbort- >SERR- <PERR- INTx-
	Latency: 0
	Interrupt: pin A routed to IRQ 21
	Region 0: Memory at fea04000 (32-bit, non-prefetchable) [size=4K]
	Bus: primary=00, secondary=05, subordinate=05, sec-latency=0
	I/O behind bridge: 5000-5fff [size=4K] [16-bit]
	Memory behind bridge: fe000000-fe1fffff [size=2M] [32-bit]
	Prefetchable memory behind bridge: e9200000000-e93ffffffff [size=8G] [32-bit]
	Secondary status: 66MHz- FastB2B- ParErr- DEVSEL=fast >TAbort- <TAbort- <MAbort- <SERR- <PERR-
	BridgeCtl: Parity- SERR+ NoISA- VGA- VGA16- MAbort- >Reset- FastB2B-
		PriDiscTmr- SecDiscTmr- DiscTmrStat- DiscTmrSERREn-
	Capabilities: <access denied>
	Kernel driver in use: pcieport

00:01.5 PCI bridge: Red Hat, Inc. QEMU PCIe Root port (prog-if 00 [Normal decode])
	Subsystem: Red Hat, Inc. QEMU PCIe Root port
	Control: I/O+ Mem+ BusMaster+ SpecCycle- MemWINV- VGASnoop- ParErr- Stepping- SERR+ FastB2B- DisINTx+
	Status: Cap+ 66MHz- UDF- FastB2B- ParErr- DEVSEL=fast >TAbort- <TAbort- <MAbort- >SERR- <PERR- INTx-
	Latency: 0
	Interrupt: pin A routed to IRQ 21
	Region 0: Memory at fea05000 (32-bit, non-prefetchable) [size=4K]
	Bus: primary=00, secondary=06, subordinate=06, sec-latency=0
	I/O behind bridge: 6000-6fff [size=4K] [16-bit]
	Memory behind bridge: fde00000-fdffffff [size=2M] [32-bit]
	Prefetchable memory behind bridge: e9000000000-e91ffffffff [size=8G] [32-bit]
	Secondary status: 66MHz- FastB2B- ParErr- DEVSEL=fast >TAbort- <TAbort- <MAbort- <SERR- <PERR-
	BridgeCtl: Parity- SERR+ NoISA- VGA- VGA16- MAbort- >Reset- FastB2B-
		PriDiscTmr- SecDiscTmr- DiscTmrStat- DiscTmrSERREn-
	Capabilities: <access denied>
	Kernel driver in use: pcieport

00:01.6 PCI bridge: Red Hat, Inc. QEMU PCIe Root port (prog-if 00 [Normal decode])
	Subsystem: Red Hat, Inc. QEMU PCIe Root port
	Control: I/O+ Mem+ BusMaster+ SpecCycle- MemWINV- VGASnoop- ParErr- Stepping- SERR+ FastB2B- DisINTx+
	Status: Cap+ 66MHz- UDF- FastB2B- ParErr- DEVSEL=fast >TAbort- <TAbort- <MAbort- >SERR- <PERR- INTx-
	Latency: 0
	Interrupt: pin A routed to IRQ 21
	Region 0: Memory at fea06000 (32-bit, non-prefetchable) [size=4K]
	Bus: primary=00, secondary=07, subordinate=07, sec-latency=0
	I/O behind bridge: 7000-7fff [size=4K] [16-bit]
	Memory behind bridge: fdc00000-fddfffff [size=2M] [32-bit]
	Prefetchable memory behind bridge: e8e00000000-e8fffffffff [size=8G] [32-bit]
	Secondary status: 66MHz- FastB2B- ParErr- DEVSEL=fast >TAbort- <TAbort- <MAbort- <SERR- <PERR-
	BridgeCtl: Parity- SERR+ NoISA- VGA- VGA16- MAbort- >Reset- FastB2B-
		PriDiscTmr- SecDiscTmr- DiscTmrStat- DiscTmrSERREn-
	Capabilities: <access denied>
	Kernel driver in use: pcieport

00:01.7 PCI bridge: Red Hat, Inc. QEMU PCIe Root port (prog-if 00 [Normal decode])
	Subsystem: Red Hat, Inc. QEMU PCIe Root port
	Control: I/O+ Mem+ BusMaster+ SpecCycle- MemWINV- VGASnoop- ParErr- Stepping- SERR+ FastB2B- DisINTx+
	Status: Cap+ 66MHz- UDF- FastB2B- ParErr- DEVSEL=fast >TAbort- <TAbort- <MAbort- >SERR- <PERR- INTx-
	Latency: 0
	Interrupt: pin A routed to IRQ 21
	Region 0: Memory at fea07000 (32-bit, non-prefetchable) [size=4K]
	Bus: primary=00, secondary=08, subordinate=08, sec-latency=0
	I/O behind bridge: 8000-8fff [size=4K] [16-bit]
	Memory behind bridge: fda00000-fdbfffff [size=2M] [32-bit]
	Prefetchable memory behind bridge: e8c00000000-e8dffffffff [size=8G] [32-bit]
	Secondary status: 66MHz- FastB2B- ParErr- DEVSEL=fast >TAbort- <TAbort- <MAbort- <SERR- <PERR-
	BridgeCtl: Parity- SERR+ NoISA- VGA- VGA16- MAbort- >Reset- FastB2B-
		PriDiscTmr- SecDiscTmr- DiscTmrStat- DiscTmrSERREn-
	Capabilities: <access denied>
	Kernel driver in use: pcieport

00:02.0 PCI bridge: Red Hat, Inc. QEMU PCIe Root port (prog-if 00 [Normal decode])
	Subsystem: Red Hat, Inc. QEMU PCIe Root port
	Control: I/O+ Mem+ BusMaster+ SpecCycle- MemWINV- VGASnoop- ParErr- Stepping- SERR+ FastB2B- DisINTx+
	Status: Cap+ 66MHz- UDF- FastB2B- ParErr- DEVSEL=fast >TAbort- <TAbort- <MAbort- >SERR- <PERR- INTx-
	Latency: 0
	Interrupt: pin A routed to IRQ 22
	Region 0: Memory at fea08000 (32-bit, non-prefetchable) [size=4K]
	Bus: primary=00, secondary=09, subordinate=09, sec-latency=0
	I/O behind bridge: 9000-9fff [size=4K] [16-bit]
	Memory behind bridge: fd800000-fd9fffff [size=2M] [32-bit]
	Prefetchable memory behind bridge: e8a00000000-e8bffffffff [size=8G] [32-bit]
	Secondary status: 66MHz- FastB2B- ParErr- DEVSEL=fast >TAbort- <TAbort- <MAbort- <SERR- <PERR-
	BridgeCtl: Parity- SERR+ NoISA- VGA- VGA16- MAbort- >Reset- FastB2B-
		PriDiscTmr- SecDiscTmr- DiscTmrStat- DiscTmrSERREn-
	Capabilities: <access denied>
	Kernel driver in use: pcieport

00:02.1 PCI bridge: Red Hat, Inc. QEMU PCIe Root port (prog-if 00 [Normal decode])
	Subsystem: Red Hat, Inc. QEMU PCIe Root port
	Control: I/O+ Mem+ BusMaster+ SpecCycle- MemWINV- VGASnoop- ParErr- Stepping- SERR+ FastB2B- DisINTx+
	Status: Cap+ 66MHz- UDF- FastB2B- ParErr- DEVSEL=fast >TAbort- <TAbort- <MAbort- >SERR- <PERR- INTx-
	Latency: 0
	Interrupt: pin A routed to IRQ 22
	Region 0: Memory at fea09000 (32-bit, non-prefetchable) [size=4K]
	Bus: primary=00, secondary=0a, subordinate=0a, sec-latency=0
	I/O behind bridge: a000-afff [size=4K] [16-bit]
	Memory behind bridge: fd600000-fd7fffff [size=2M] [32-bit]
	Prefetchable memory behind bridge: e8800000000-e89ffffffff [size=8G] [32-bit]
	Secondary status: 66MHz- FastB2B- ParErr- DEVSEL=fast >TAbort- <TAbort- <MAbort- <SERR- <PERR-
	BridgeCtl: Parity- SERR+ NoISA- VGA- VGA16- MAbort- >Reset- FastB2B-
		PriDiscTmr- SecDiscTmr- DiscTmrStat- DiscTmrSERREn-
	Capabilities: <access denied>
	Kernel driver in use: pcieport

00:02.2 PCI bridge: Red Hat, Inc. QEMU PCIe Root port (prog-if 00 [Normal decode])
	Subsystem: Red Hat, Inc. QEMU PCIe Root port
	Control: I/O+ Mem+ BusMaster+ SpecCycle- MemWINV- VGASnoop- ParErr- Stepping- SERR+ FastB2B- DisINTx+
	Status: Cap+ 66MHz- UDF- FastB2B- ParErr- DEVSEL=fast >TAbort- <TAbort- <MAbort- >SERR- <PERR- INTx-
	Latency: 0
	Interrupt: pin A routed to IRQ 22
	Region 0: Memory at fea0a000 (32-bit, non-prefetchable) [size=4K]
	Bus: primary=00, secondary=0b, subordinate=0b, sec-latency=0
	I/O behind bridge: b000-bfff [size=4K] [16-bit]
	Memory behind bridge: fd400000-fd5fffff [size=2M] [32-bit]
	Prefetchable memory behind bridge: e8600000000-e87ffffffff [size=8G] [32-bit]
	Secondary status: 66MHz- FastB2B- ParErr- DEVSEL=fast >TAbort- <TAbort- <MAbort- <SERR- <PERR-
	BridgeCtl: Parity- SERR+ NoISA- VGA- VGA16- MAbort- >Reset- FastB2B-
		PriDiscTmr- SecDiscTmr- DiscTmrStat- DiscTmrSERREn-
	Capabilities: <access denied>
	Kernel driver in use: pcieport

00:02.3 PCI bridge: Red Hat, Inc. QEMU PCIe Root port (prog-if 00 [Normal decode])
	Subsystem: Red Hat, Inc. QEMU PCIe Root port
	Control: I/O+ Mem+ BusMaster+ SpecCycle- MemWINV- VGASnoop- ParErr- Stepping- SERR+ FastB2B- DisINTx+
	Status: Cap+ 66MHz- UDF- FastB2B- ParErr- DEVSEL=fast >TAbort- <TAbort- <MAbort- >SERR- <PERR- INTx-
	Latency: 0
	Interrupt: pin A routed to IRQ 22
	Region 0: Memory at fea0b000 (32-bit, non-prefetchable) [size=4K]
	Bus: primary=00, secondary=0c, subordinate=0c, sec-latency=0
	I/O behind bridge: d000-dfff [size=4K] [16-bit]
	Memory behind bridge: fd200000-fd3fffff [size=2M] [32-bit]
	Prefetchable memory behind bridge: e8400000000-e85ffffffff [size=8G] [32-bit]
	Secondary status: 66MHz- FastB2B- ParErr- DEVSEL=fast >TAbort- <TAbort- <MAbort- <SERR- <PERR-
	BridgeCtl: Parity- SERR+ NoISA- VGA- VGA16- MAbort- >Reset- FastB2B-
		PriDiscTmr- SecDiscTmr- DiscTmrStat- DiscTmrSERREn-
	Capabilities: <access denied>
	Kernel driver in use: pcieport

00:02.4 PCI bridge: Red Hat, Inc. QEMU PCIe Root port (prog-if 00 [Normal decode])
	Subsystem: Red Hat, Inc. QEMU PCIe Root port
	Control: I/O+ Mem+ BusMaster+ SpecCycle- MemWINV- VGASnoop- ParErr- Stepping- SERR+ FastB2B- DisINTx+
	Status: Cap+ 66MHz- UDF- FastB2B- ParErr- DEVSEL=fast >TAbort- <TAbort- <MAbort- >SERR- <PERR- INTx-
	Latency: 0
	Interrupt: pin A routed to IRQ 22
	Region 0: Memory at fea0c000 (32-bit, non-prefetchable) [size=4K]
	Bus: primary=00, secondary=0d, subordinate=0d, sec-latency=0
	I/O behind bridge: e000-efff [size=4K] [16-bit]
	Memory behind bridge: fd000000-fd1fffff [size=2M] [32-bit]
	Prefetchable memory behind bridge: e8200000000-e83ffffffff [size=8G] [32-bit]
	Secondary status: 66MHz- FastB2B- ParErr- DEVSEL=fast >TAbort- <TAbort- <MAbort- <SERR- <PERR-
	BridgeCtl: Parity- SERR+ NoISA- VGA- VGA16- MAbort- >Reset- FastB2B-
		PriDiscTmr- SecDiscTmr- DiscTmrStat- DiscTmrSERREn-
	Capabilities: <access denied>
	Kernel driver in use: pcieport

00:02.5 PCI bridge: Red Hat, Inc. QEMU PCIe Root port (prog-if 00 [Normal decode])
	Subsystem: Red Hat, Inc. QEMU PCIe Root port
	Control: I/O+ Mem+ BusMaster+ SpecCycle- MemWINV- VGASnoop- ParErr- Stepping- SERR+ FastB2B- DisINTx+
	Status: Cap+ 66MHz- UDF- FastB2B- ParErr- DEVSEL=fast >TAbort- <TAbort- <MAbort- >SERR- <PERR- INTx-
	Latency: 0
	Interrupt: pin A routed to IRQ 22
	Region 0: Memory at fea0d000 (32-bit, non-prefetchable) [size=4K]
	Bus: primary=00, secondary=0e, subordinate=0e, sec-latency=0
	I/O behind bridge: f000-ffff [size=4K] [16-bit]
	Memory behind bridge: fce00000-fcffffff [size=2M] [32-bit]
	Prefetchable memory behind bridge: e8000000000-e81ffffffff [size=8G] [32-bit]
	Secondary status: 66MHz- FastB2B- ParErr- DEVSEL=fast >TAbort- <TAbort- <MAbort- <SERR- <PERR-
	BridgeCtl: Parity- SERR+ NoISA- VGA- VGA16- MAbort- >Reset- FastB2B-
		PriDiscTmr- SecDiscTmr- DiscTmrStat- DiscTmrSERREn-
	Capabilities: <access denied>
	Kernel driver in use: pcieport

00:03.0 Host bridge: Red Hat, Inc. QEMU PCIe Expander bridge
	Subsystem: Red Hat, Inc. QEMU PCIe Expander bridge
	Control: I/O+ Mem+ BusMaster- SpecCycle- MemWINV- VGASnoop- ParErr- Stepping- SERR+ FastB2B- DisINTx-
	Status: Cap- 66MHz+ UDF- FastB2B+ ParErr- DEVSEL=fast >TAbort- <TAbort- <MAbort- >SERR- <PERR- INTx-

00:1f.0 ISA bridge: Intel Corporation 82801IB (ICH9) LPC Interface Controller (rev 02)
	Subsystem: Red Hat, Inc. QEMU Virtual Machine
	Control: I/O+ Mem+ BusMaster- SpecCycle- MemWINV- VGASnoop- ParErr- Stepping- SERR+ FastB2B- DisINTx-
	Status: Cap- 66MHz- UDF- FastB2B- ParErr- DEVSEL=fast >TAbort- <TAbort- <MAbort- >SERR- <PERR- INTx-
	Kernel driver in use: lpc_ich
	Kernel modules: lpc_ich

00:1f.2 SATA controller: Intel Corporation 82801IR/IO/IH (ICH9R/DO/DH) 6 port SATA Controller [AHCI mode] (rev 02) (prog-if 01 [AHCI 1.0])
	Subsystem: Red Hat, Inc. QEMU Virtual Machine
	Control: I/O+ Mem+ BusMaster+ SpecCycle- MemWINV- VGASnoop- ParErr- Stepping- SERR+ FastB2B- DisINTx+
	Status: Cap+ 66MHz- UDF- FastB2B- ParErr- DEVSEL=fast >TAbort- <TAbort- <MAbort- >SERR- <PERR- INTx-
	Latency: 0
	Interrupt: pin A routed to IRQ 57
	Region 4: I/O ports at c040 [size=32]
	Region 5: Memory at fea0e000 (32-bit, non-prefetchable) [size=4K]
	Capabilities: <access denied>
	Kernel driver in use: ahci
	Kernel modules: ahci

00:1f.3 SMBus: Intel Corporation 82801I (ICH9 Family) SMBus Controller (rev 02)
	Subsystem: Red Hat, Inc. QEMU Virtual Machine
	Control: I/O+ Mem+ BusMaster- SpecCycle- MemWINV- VGASnoop- ParErr- Stepping- SERR+ FastB2B- DisINTx-
	Status: Cap- 66MHz- UDF- FastB2B- ParErr- DEVSEL=fast >TAbort- <TAbort- <MAbort- >SERR- <PERR- INTx-
	Interrupt: pin A routed to IRQ 16
	Region 4: I/O ports at 0700 [size=64]
	Kernel driver in use: i801_smbus
	Kernel modules: i2c_i801

01:00.0 Ethernet controller: Red Hat, Inc. Virtio 1.0 network device (rev 01)
	Subsystem: Red Hat, Inc. Virtio 1.0 network device
	Physical Slot: 0
	Control: I/O+ Mem+ BusMaster+ SpecCycle- MemWINV- VGASnoop- ParErr- Stepping- SERR+ FastB2B- DisINTx+
	Status: Cap+ 66MHz- UDF- FastB2B- ParErr- DEVSEL=fast >TAbort- <TAbort- <MAbort- >SERR- <PERR- INTx-
	Latency: 0
	Interrupt: pin A routed to IRQ 21
	Region 1: Memory at fe880000 (32-bit, non-prefetchable) [size=4K]
	Region 4: Memory at e9a00000000 (64-bit, prefetchable) [size=16K]
	Expansion ROM at fe800000 [disabled] [size=512K]
	Capabilities: <access denied>
	Kernel driver in use: virtio-pci

02:00.0 USB controller: Red Hat, Inc. QEMU XHCI Host Controller (rev 01) (prog-if 30 [XHCI])
	Subsystem: Red Hat, Inc. QEMU XHCI Host Controller
	Physical Slot: 0-2
	Control: I/O+ Mem+ BusMaster+ SpecCycle- MemWINV- VGASnoop- ParErr- Stepping- SERR+ FastB2B- DisINTx+
	Status: Cap+ 66MHz- UDF- FastB2B- ParErr- DEVSEL=fast >TAbort- <TAbort- <MAbort- >SERR- <PERR- INTx-
	Latency: 0, Cache Line Size: 64 bytes
	Interrupt: pin A routed to IRQ 21
	Region 0: Memory at fe600000 (64-bit, non-prefetchable) [size=16K]
	Capabilities: <access denied>
	Kernel driver in use: xhci_hcd
	Kernel modules: xhci_pci

03:00.0 Communication controller: Red Hat, Inc. Virtio 1.0 console (rev 01)
	Subsystem: Red Hat, Inc. Virtio 1.0 console
	Physical Slot: 0-3
	Control: I/O+ Mem+ BusMaster+ SpecCycle- MemWINV- VGASnoop- ParErr- Stepping- SERR+ FastB2B- DisINTx+
	Status: Cap+ 66MHz- UDF- FastB2B- ParErr- DEVSEL=fast >TAbort- <TAbort- <MAbort- >SERR- <PERR- INTx-
	Latency: 0
	Interrupt: pin A routed to IRQ 21
	Region 1: Memory at fe400000 (32-bit, non-prefetchable) [size=4K]
	Region 4: Memory at e9600000000 (64-bit, prefetchable) [size=16K]
	Capabilities: <access denied>
	Kernel driver in use: virtio-pci

04:00.0 SCSI storage controller: Red Hat, Inc. Virtio 1.0 block device (rev 01)
	Subsystem: Red Hat, Inc. Virtio 1.0 block device
	Physical Slot: 0-4
	Control: I/O+ Mem+ BusMaster+ SpecCycle- MemWINV- VGASnoop- ParErr- Stepping- SERR+ FastB2B- DisINTx+
	Status: Cap+ 66MHz- UDF- FastB2B- ParErr- DEVSEL=fast >TAbort- <TAbort- <MAbort- >SERR- <PERR- INTx-
	Latency: 0
	Interrupt: pin A routed to IRQ 21
	Region 1: Memory at fe200000 (32-bit, non-prefetchable) [size=4K]
	Region 4: Memory at e9400000000 (64-bit, prefetchable) [size=16K]
	Capabilities: <access denied>
	Kernel driver in use: virtio-pci

05:00.0 Unclassified device [00ff]: Red Hat, Inc. Virtio 1.0 memory balloon (rev 01)
	Subsystem: Red Hat, Inc. Virtio 1.0 memory balloon
	Physical Slot: 0-5
	Control: I/O+ Mem+ BusMaster+ SpecCycle- MemWINV- VGASnoop- ParErr- Stepping- SERR+ FastB2B- DisINTx+
	Status: Cap+ 66MHz- UDF- FastB2B- ParErr- DEVSEL=fast >TAbort- <TAbort- <MAbort- >SERR- <PERR- INTx-
	Latency: 0
	Interrupt: pin A routed to IRQ 21
	Region 1: Memory at fe000000 (32-bit, non-prefetchable) [size=4K]
	Region 4: Memory at e9200000000 (64-bit, prefetchable) [size=16K]
	Capabilities: <access denied>
	Kernel driver in use: virtio-pci

06:00.0 Unclassified device [00ff]: Red Hat, Inc. Virtio 1.0 RNG (rev 01)
	Subsystem: Red Hat, Inc. Virtio 1.0 RNG
	Physical Slot: 0-6
	Control: I/O+ Mem+ BusMaster+ SpecCycle- MemWINV- VGASnoop- ParErr- Stepping- SERR+ FastB2B- DisINTx+
	Status: Cap+ 66MHz- UDF- FastB2B- ParErr- DEVSEL=fast >TAbort- <TAbort- <MAbort- >SERR- <PERR- INTx-
	Latency: 0
	Interrupt: pin A routed to IRQ 21
	Region 1: Memory at fde00000 (32-bit, non-prefetchable) [size=4K]
	Region 4: Memory at e9000000000 (64-bit, prefetchable) [size=16K]
	Capabilities: <access denied>
	Kernel driver in use: virtio-pci

fe:00.0 PCI bridge: Red Hat, Inc. QEMU PCIe Root port (prog-if 00 [Normal decode])
	Subsystem: Red Hat, Inc. QEMU PCIe Root port
	Control: I/O+ Mem+ BusMaster+ SpecCycle- MemWINV- VGASnoop- ParErr- Stepping- SERR+ FastB2B- DisINTx+
	Status: Cap+ 66MHz- UDF- FastB2B- ParErr- DEVSEL=fast >TAbort- <TAbort- <MAbort- >SERR- <PERR- INTx-
	Latency: 0
	Interrupt: pin A routed to IRQ 11
	NUMA node: 0
	Region 0: Memory at fea0f000 (32-bit, non-prefetchable) [size=4K]
	Bus: primary=fe, secondary=ff, subordinate=ff, sec-latency=0
	I/O behind bridge: [disabled] [16-bit]
	Memory behind bridge: fcc00000-fcdfffff [size=2M] [32-bit]
	Prefetchable memory behind bridge: e0000000000-e7fffffffff [size=512G] [32-bit]
	Secondary status: 66MHz- FastB2B- ParErr- DEVSEL=fast >TAbort- <TAbort- <MAbort- <SERR- <PERR-
	BridgeCtl: Parity- SERR+ NoISA- VGA- VGA16- MAbort- >Reset- FastB2B-
		PriDiscTmr- SecDiscTmr- DiscTmrStat- DiscTmrSERREn-
	Capabilities: <access denied>
	Kernel driver in use: pcieport

ff:00.0 Processing accelerators: Advanced Micro Devices, Inc. [AMD/ATI] Device 74b5
	Subsystem: Advanced Micro Devices, Inc. [AMD/ATI] Device 74a1
	Physical Slot: 0-1
	Control: I/O- Mem+ BusMaster+ SpecCycle- MemWINV- VGASnoop- ParErr- Stepping- SERR- FastB2B- DisINTx+
	Status: Cap+ 66MHz- UDF- FastB2B- ParErr- DEVSEL=fast >TAbort- <TAbort- <MAbort- >SERR- <PERR- INTx-
	Latency: 0
	NUMA node: 0
	Region 0: Memory at e0000000000 (64-bit, prefetchable) [size=256G]
	Region 2: Memory at e4000000000 (64-bit, prefetchable) [size=2M]
	Region 5: Memory at fcc00000 (32-bit, non-prefetchable) [size=2M]
	Capabilities: <access denied>
	Kernel driver in use: amdgpu
	Kernel modules: amdgpu

